<?xml version="1.0" encoding="UTF-8"?>
<?xml-stylesheet type="text/xsl" href="NewStylesheetCAT1.xsl" ?>
<Company Emp_id="0" xmlns:xsi="http://www.w3.org/2001/XMLSchema-instance" xsi:noNamespaceSchemaLocation="./NewXMLSchemaCAT1.xsd">
  <Employee>
  
    <Emp_name>Divya V Prasad</Emp_name>
    <Emp_age>21</Emp_age>
    <Emp_salary>50000</Emp_salary>
    <Emp_emailid>divyavprasad@gmail.com</Emp_emailid>
    <Emp_phonenum>9667609376</Emp_phonenum>
    <Emp_designation>WebDeveloper</Emp_designation>
  </Employee>
  
  <Employee>
    <Emp_name>Praveen Nair</Emp_name>
    <Emp_age>29</Emp_age>
    <Emp_salary>100000</Emp_salary>
    <Emp_emailid>praveenprasad@gmail.com</Emp_emailid>
    <Emp_phonenum>9667309376</Emp_phonenum>
    <Emp_designation>JavaDeveloper</Emp_designation>
  </Employee>
  
  <Employee>
    <Emp_name>Sukhwinder Singh</Emp_name>
    <Emp_age>31</Emp_age>
    <Emp_salary>50000</Emp_salary>
    <Emp_emailid>sukhvinder@gmail.com</Emp_emailid>
    <Emp_phonenum>9667609376</Emp_phonenum>
    <Emp_designation>TeamLeader</Emp_designation>
  </Employee>
</Company>
